{
  "schemaVersion": 1,
  "project": {
    "name": "host",
    "root": "."
  },
  "bundler": {
    "name": "vite",
    "mode": "ci"
  },
  "capabilities": {
    "config": true,
    "sourceImports": true,
    "manifest": false,
    "stats": false,
    "emittedAssets": false,
    "installedVersions": true
  },
  "moduleFederation": {
    "name": "host",
    "exposes": {},
    "remotes": {},
    "shared": {}
  },
  "dependencies": {
    "declared": {
      "zustand": "^5.0.0"
    },
    "installed": {
      "zustand": "5.0.3"
    }
  },
  "imports": {
    "sourceFiles": ["src/App.ts"],
    "specifiers": ["zustand"],
    "packages": ["zustand"],
    "dynamicPackages": [],
    "remotes": [],
    "unresolvedDynamic": [],
    "evidenceSources": ["source"]
  },
  "artifacts": {
    "emittedAssets": []
  }
}
