{
  "schemaVersion": 1,
  "project": {
    "name": "host",
    "root": "."
  },
  "bundler": {
    "name": "vite",
    "mode": "ci"
  },
  "capabilities": {
    "config": true,
    "sourceImports": true,
    "manifest": false,
    "stats": false,
    "emittedAssets": false,
    "installedVersions": true
  },
  "moduleFederation": {
    "name": "host",
    "exposes": {},
    "remotes": {
      "shop": {
        "name": "shop",
        "entry": "https://example.test/shop/mf-manifest.json",
        "shareScope": ["default"]
      }
    },
    "shared": {}
  },
  "dependencies": {
    "declared": {},
    "installed": {}
  },
  "imports": {
    "sourceFiles": [],
    "specifiers": [],
    "packages": []
  },
  "artifacts": {
    "emittedAssets": []
  }
}
