{
  "schemaVersion": 1,
  "project": {
    "name": "remote",
    "root": "."
  },
  "bundler": {
    "name": "vite",
    "mode": "ci"
  },
  "capabilities": {
    "config": true,
    "sourceImports": true,
    "manifest": false,
    "stats": false,
    "emittedAssets": false,
    "installedVersions": true
  },
  "moduleFederation": {
    "name": "remote",
    "exposes": {},
    "remotes": {},
    "shared": {
      "react": {
        "package": "react",
        "singleton": true,
        "eager": false,
        "requiredVersion": "^19.1.0",
        "shareScope": ["legacy"]
      }
    }
  },
  "dependencies": {
    "declared": {
      "react": "^19.1.0"
    },
    "installed": {
      "react": "19.2.8"
    }
  },
  "imports": {
    "sourceFiles": [],
    "specifiers": [],
    "packages": []
  },
  "artifacts": {
    "emittedAssets": []
  }
}
