{
  "schemaVersion": 1,
  "project": {
    "name": "host",
    "root": "."
  },
  "bundler": {
    "name": "vite",
    "mode": "ci"
  },
  "capabilities": {
    "config": true,
    "sourceImports": true,
    "manifest": false,
    "stats": false,
    "emittedAssets": false,
    "installedVersions": true
  },
  "moduleFederation": {
    "name": "host",
    "exposes": {},
    "remotes": {},
    "shared": {
      "lodash": {
        "package": "lodash",
        "singleton": false,
        "eager": false,
        "requiredVersion": "^4.17.0",
        "shareScope": ["default"]
      }
    }
  },
  "dependencies": {
    "declared": {
      "lodash": "^4.17.0"
    },
    "installed": {
      "lodash": "4.17.21"
    }
  },
  "imports": {
    "sourceFiles": [],
    "specifiers": [],
    "packages": [],
    "dynamicPackages": [],
    "remotes": [],
    "unresolvedDynamic": [],
    "evidenceSources": []
  },
  "artifacts": {
    "emittedAssets": []
  }
}
