{
  "schemaVersion": 1,
  "project": {
    "name": "host",
    "root": "."
  },
  "bundler": {
    "name": "vite",
    "mode": "production"
  },
  "capabilities": {
    "config": true,
    "sourceImports": true,
    "manifest": true,
    "stats": false,
    "emittedAssets": true,
    "installedVersions": true
  },
  "moduleFederation": {
    "name": "host",
    "exposes": {},
    "remotes": {
      "checkout": {
        "name": "checkout",
        "entry": "https://cdn.example.com/checkout/mf-manifest.json",
        "shareScope": "default"
      }
    },
    "shared": {
      "react": {
        "package": "react",
        "singleton": true,
        "eager": false,
        "requiredVersion": "^19.0.0",
        "shareScope": ["default"]
      }
    }
  },
  "dependencies": {
    "declared": {
      "react": "^19.0.0"
    },
    "installed": {
      "react": "19.1.1"
    }
  },
  "imports": {
    "sourceFiles": [],
    "specifiers": [],
    "packages": ["react"]
  },
  "artifacts": {
    "emittedAssets": [],
    "manifest": {
      "path": "mf-manifest.json",
      "valid": true,
      "id": "host",
      "name": "host",
      "publicPath": "https://cdn.example.com/host/",
      "exposes": [],
      "shared": []
    }
  }
}
